{
  "kind": "andyai.artifact_viewer.index",
  "version": "1.0",
  "generated_at": "2026-05-17T01:30:20Z",
  "repo": {
    "name": "andyai-second-brain",
    "path": "/Users/andrijakolundzic/Documents/Projects/andyai-second-brain",
    "head": "bacf09c",
    "remote": "git@github.com:kolundzic/andyai-second-brain.git",
    "latest_tags": [
      "v60.4.0",
      "v60.3.0",
      "v60.2.0",
      "v60.1.0",
      "v60.0.1",
      "v60.0.0",
      "v59.9.0",
      "v59.8.0",
      "v59.7.0",
      "v59.6.0",
      "v59.5.0",
      "v59.4.0",
      "v59.3.0",
      "v59.1.0",
      "v59.2.0",
      "v58.9.0",
      "v59.0.0",
      "v58.8.0",
      "v58.5.0",
      "v58.6.0"
    ]
  },
  "sections": [
    {
      "id": "dashboard",
      "title": "Dashboard Artifacts",
      "items": [
        {
          "path": "brain/dashboard/DASHBOARD_SCAFFOLD.md",
          "name": "DASHBOARD_SCAFFOLD.md",
          "size": 112,
          "type": "md"
        },
        {
          "path": "brain/dashboard/PACK25_QA_FINAL.md",
          "name": "PACK25_QA_FINAL.md",
          "size": 285,
          "type": "md"
        },
        {
          "path": "brain/dashboard/exports/bridge-hub-dashboard-feed.zip",
          "name": "bridge-hub-dashboard-feed.zip",
          "size": 4965,
          "type": "zip"
        },
        {
          "path": "brain/dashboard/feed/bridge-hub-feed.json",
          "name": "bridge-hub-feed.json",
          "size": 10573,
          "type": "json"
        },
        {
          "path": "brain/dashboard/html/bridge-hub-dashboard.html",
          "name": "bridge-hub-dashboard.html",
          "size": 10948,
          "type": "html"
        },
        {
          "path": "brain/dashboard/reports/bridge-hub-dashboard.md",
          "name": "bridge-hub-dashboard.md",
          "size": 688,
          "type": "md"
        }
      ]
    },
    {
      "id": "doctor",
      "title": "Doctor Artifacts",
      "items": [
        {
          "path": "brain/doctor/DOCTOR_SCAFFOLD.md",
          "name": "DOCTOR_SCAFFOLD.md",
          "size": 85,
          "type": "md"
        },
        {
          "path": "brain/doctor/PACK24_QA_FINAL.md",
          "name": "PACK24_QA_FINAL.md",
          "size": 276,
          "type": "md"
        },
        {
          "path": "brain/doctor/exports/brain-doctor-evidence.zip",
          "name": "brain-doctor-evidence.zip",
          "size": 1081,
          "type": "zip"
        },
        {
          "path": "brain/doctor/reports/brain-doctor-report.json",
          "name": "brain-doctor-report.json",
          "size": 2698,
          "type": "json"
        },
        {
          "path": "brain/doctor/reports/brain-doctor-report.md",
          "name": "brain-doctor-report.md",
          "size": 169,
          "type": "md"
        }
      ]
    },
    {
      "id": "reports",
      "title": "Reports",
      "items": [
        {
          "path": "brain/reports/BATTLE_PACK24_REPORT.md",
          "name": "BATTLE_PACK24_REPORT.md",
          "size": 400,
          "type": "md"
        },
        {
          "path": "brain/reports/BATTLE_PACK25_REPORT.md",
          "name": "BATTLE_PACK25_REPORT.md",
          "size": 453,
          "type": "md"
        },
        {
          "path": "brain/reports/BATTLE_PACK26_REPORT.md",
          "name": "BATTLE_PACK26_REPORT.md",
          "size": 474,
          "type": "md"
        },
        {
          "path": "brain/reports/BATTLE_PACK27_REPORT.md",
          "name": "BATTLE_PACK27_REPORT.md",
          "size": 557,
          "type": "md"
        },
        {
          "path": "brain/reports/BATTLE_PACK28_REPORT.md",
          "name": "BATTLE_PACK28_REPORT.md",
          "size": 476,
          "type": "md"
        },
        {
          "path": "brain/reports/BATTLE_PACK29_REPORT.md",
          "name": "BATTLE_PACK29_REPORT.md",
          "size": 397,
          "type": "md"
        },
        {
          "path": "brain/reports/BIG_PLOTUN_01_REPORT.md",
          "name": "BIG_PLOTUN_01_REPORT.md",
          "size": 650,
          "type": "md"
        },
        {
          "path": "brain/reports/BIG_PLOTUN_02_REPORT.md",
          "name": "BIG_PLOTUN_02_REPORT.md",
          "size": 535,
          "type": "md"
        },
        {
          "path": "brain/reports/BIG_PLOTUN_03_REPORT.md",
          "name": "BIG_PLOTUN_03_REPORT.md",
          "size": 755,
          "type": "md"
        },
        {
          "path": "brain/reports/BRIDGE_HUB_HANDOFF_REPORT.md",
          "name": "BRIDGE_HUB_HANDOFF_REPORT.md",
          "size": 249,
          "type": "md"
        },
        {
          "path": "brain/reports/BRIDGE_HUB_OPERATOR_PANEL_STUB.md",
          "name": "BRIDGE_HUB_OPERATOR_PANEL_STUB.md",
          "size": 157,
          "type": "md"
        },
        {
          "path": "brain/reports/OPS_DASHBOARD.md",
          "name": "OPS_DASHBOARD.md",
          "size": 282,
          "type": "md"
        },
        {
          "path": "brain/reports/PACK3_DIRTY_TREE_REPAIR_STATUS.md",
          "name": "PACK3_DIRTY_TREE_REPAIR_STATUS.md",
          "size": 478,
          "type": "md"
        },
        {
          "path": "brain/reports/PACK4_CONTEXT_ASSEMBLY_REPORT.md",
          "name": "PACK4_CONTEXT_ASSEMBLY_REPORT.md",
          "size": 339,
          "type": "md"
        },
        {
          "path": "brain/reports/PACK4_FINAL_QA.md",
          "name": "PACK4_FINAL_QA.md",
          "size": 306,
          "type": "md"
        },
        {
          "path": "brain/reports/PACK4_RETRIEVAL_QA.md",
          "name": "PACK4_RETRIEVAL_QA.md",
          "size": 324,
          "type": "md"
        },
        {
          "path": "brain/reports/PACK5_LOCK_REPORT.md",
          "name": "PACK5_LOCK_REPORT.md",
          "size": 164,
          "type": "md"
        },
        {
          "path": "brain/reports/PACK7_TRUST_LEDGER_AUDIT_LOCK.md",
          "name": "PACK7_TRUST_LEDGER_AUDIT_LOCK.md",
          "size": 311,
          "type": "md"
        },
        {
          "path": "brain/reports/PACK8_MEMORY_LIFECYCLE_LOCK.md",
          "name": "PACK8_MEMORY_LIFECYCLE_LOCK.md",
          "size": 425,
          "type": "md"
        },
        {
          "path": "brain/reports/PACK9_PACK_INTELLIGENCE_REPORT.md",
          "name": "PACK9_PACK_INTELLIGENCE_REPORT.md",
          "size": 216,
          "type": "md"
        },
        {
          "path": "brain/reports/PACK_REGISTRY_DASHBOARD_STUB.md",
          "name": "PACK_REGISTRY_DASHBOARD_STUB.md",
          "size": 134,
          "type": "md"
        },
        {
          "path": "brain/reports/TIMING_DASHBOARD_STUB.md",
          "name": "TIMING_DASHBOARD_STUB.md",
          "size": 167,
          "type": "md"
        },
        {
          "path": "brain/reports/brain-report.md",
          "name": "brain-report.md",
          "size": 247,
          "type": "md"
        },
        {
          "path": "brain/reports/bridge-hub-status-report.md",
          "name": "bridge-hub-status-report.md",
          "size": 475,
          "type": "md"
        },
        {
          "path": "brain/reports/memory-lifecycle-report.md",
          "name": "memory-lifecycle-report.md",
          "size": 130,
          "type": "md"
        },
        {
          "path": "brain/reports/mission-context-report.md",
          "name": "mission-context-report.md",
          "size": 137,
          "type": "md"
        },
        {
          "path": "brain/reports/operator-readiness-report.md",
          "name": "operator-readiness-report.md",
          "size": 522,
          "type": "md"
        },
        {
          "path": "brain/reports/pack2/v2.1.0.md",
          "name": "v2.1.0.md",
          "size": 379,
          "type": "md"
        },
        {
          "path": "brain/reports/pack2/v2.2.0.md",
          "name": "v2.2.0.md",
          "size": 375,
          "type": "md"
        },
        {
          "path": "brain/reports/pack2/v2.3.0.md",
          "name": "v2.3.0.md",
          "size": 373,
          "type": "md"
        },
        {
          "path": "brain/reports/pack2/v2.4.0.md",
          "name": "v2.4.0.md",
          "size": 379,
          "type": "md"
        },
        {
          "path": "brain/reports/pack2/v2.5.0.md",
          "name": "v2.5.0.md",
          "size": 471,
          "type": "md"
        },
        {
          "path": "brain/reports/pack2/v2.6.0.md",
          "name": "v2.6.0.md",
          "size": 475,
          "type": "md"
        },
        {
          "path": "brain/reports/pack2/v2.7.0.md",
          "name": "v2.7.0.md",
          "size": 483,
          "type": "md"
        },
        {
          "path": "brain/reports/pack2/v2.8.0.md",
          "name": "v2.8.0.md",
          "size": 481,
          "type": "md"
        },
        {
          "path": "brain/reports/pack2/v2.9.0.md",
          "name": "v2.9.0.md",
          "size": 485,
          "type": "md"
        },
        {
          "path": "brain/reports/pack2/v3.0.0.md",
          "name": "v3.0.0.md",
          "size": 485,
          "type": "md"
        },
        {
          "path": "brain/reports/pack2/v3.1.0.md",
          "name": "v3.1.0.md",
          "size": 479,
          "type": "md"
        },
        {
          "path": "brain/reports/pack2/v3.2.0.md",
          "name": "v3.2.0.md",
          "size": 481,
          "type": "md"
        },
        {
          "path": "brain/reports/pack2/v3.3.0.md",
          "name": "v3.3.0.md",
          "size": 487,
          "type": "md"
        },
        {
          "path": "brain/reports/pack2/v3.4.0.md",
          "name": "v3.4.0.md",
          "size": 491,
          "type": "md"
        },
        {
          "path": "brain/reports/pack2/v3.5.0.md",
          "name": "v3.5.0.md",
          "size": 495,
          "type": "md"
        },
        {
          "path": "brain/reports/pack2/v3.6.0.md",
          "name": "v3.6.0.md",
          "size": 479,